{
  "schema_version": "treasury-rates-catalog.v1",
  "release_id": "treasury-rates-2026-08-13-64e93a5da3d1",
  "source_record_hash": "6ede8862c470fbd38ea36c95515e7ebc99774bb5b2b98bea916a63741377a04f",
  "observed_at": "2026-08-13T00:00:00Z",
  "published_at": "2026-08-13T16:35:13Z",
  "fresh_until": "2026-08-16T23:59:59Z",
  "source_url": "https://home.treasury.gov/resource-center/data-chart-center/interest-rates/pages/xml?data=daily_treasury_yield_curve&field_tdr_date_value=2026",
  "source_record_id": "https://home.treasury.gov/resource-center/data-chart-center/interest-rates/pages/xml-item?data=daily_treasury_yield_curve&id=294",
  "methodology": "Exact U.S. Treasury daily par yield curve observations; 2s10s equals the published 10-year yield minus the published 2-year yield.",
  "limitations": [
    "Treasury par yields are official interpolated curve observations based on indicative bid-side quotations, not transaction prices.",
    "The release is a dated observation and becomes stale after its declared freshness window.",
    "The 2s10s spread is deterministic arithmetic and is not a forecast or trading signal."
  ],
  "curve": [
    { "maturity": "1M", "years": 0.0833333333, "yield_pct": 3.79 },
    { "maturity": "2M", "years": 0.1666666667, "yield_pct": 3.81 },
    { "maturity": "3M", "years": 0.25, "yield_pct": 3.87 },
    { "maturity": "4M", "years": 0.3333333333, "yield_pct": 3.88 },
    { "maturity": "6M", "years": 0.5, "yield_pct": 3.94 },
    { "maturity": "1Y", "years": 1.0, "yield_pct": 3.97 },
    { "maturity": "2Y", "years": 2.0, "yield_pct": 4.15 },
    { "maturity": "3Y", "years": 3.0, "yield_pct": 4.2 },
    { "maturity": "5Y", "years": 5.0, "yield_pct": 4.32 },
    { "maturity": "7Y", "years": 7.0, "yield_pct": 4.47 },
    { "maturity": "10Y", "years": 10.0, "yield_pct": 4.63 },
    { "maturity": "20Y", "years": 20.0, "yield_pct": 5.2 },
    { "maturity": "30Y", "years": 30.0, "yield_pct": 5.21 }
  ],
  "spreads": [
    { "name": "2s10s", "value_pp": 0.48, "derived_from": ["2Y", "10Y"] }
  ],
  "manifest_hash": "64e93a5da3d102381e3de05a8c72a0ddb33a838ab4a14104e618d237798d98ad"
}
